{
  "schema": "softmatter.ask_simulation/0.1",
  "direction": "experiment_to_simulation",
  "origin": "am",
  "thread": { "id": "trap-stiffness-recovery", "round": 9, "reply_to": "../r8/ask_experiment.json" },
  "status": "supersedes_prior",
  "assumptions_resolved": false,

  "plan_ref": {
    "ref": "am:kb/plans/2026-09-15-drag-calibration-stiffness-vs-size.md",
    "hash": "sha256:3fbd1feffa0a41c2",
    "rev": "4c52c4e",
    "field": "Preconditions -- P7",
    "note": "A plain path with the revision in `rev`, per R13: the '@r<N>' form inside a ref string is what r3 and r7 carry, and it bypasses R6's revision branch. Those two keep their warnings -- they are sealed and cited, and a warning standing on a document that predates a field is the only record of when the vocabulary changed."
  },

  "claim": "P7's blocker was misnamed. It is not a data transfer: the tracked positions can be read where they are, by a tool that runs anywhere, so what the precondition waits on is a person choosing either of two interchangeable actions. `needs_data_transfer` states a requirement the design does not have, and a reader planning the next round around it would plan for the wrong thing.",

  "answering_quantity": {
    "symbol": "none",
    "unit": "dimensionless",
    "why": "This document asks for nothing. It corrects one field of r7, which this side wrote, and r8 has already answered r7's actual question. Following r4's precedent deliberately: folding a new ask into a correction lets the correction be read as a negotiation, so the next question travels separately."
  },

  "required_precision": {
    "value": 1.0,
    "unit": "dimensionless",
    "basis": "Structurally required by the schema and carrying no meaning here, because nothing is being asked. The value 1 is a placeholder and is not a target; no simulator time should be spent against it.",
    "set_by": "am"
  },

  "what_would_change_my_mind": "Nothing, in the sense a claim usually means: this is a correction to a field of this side's own document rather than a hypothesis about the world. If the tracked positions turn out to be unreadable where they are -- a format no numpy reader can open, or a machine nobody can run a Python process on -- then `needs_data_transfer` was right after all and this correction is itself wrong. Neither is true today: the files are two columns of text and the fit needs three packages.",

  "system_primitives": [
    { "symbol": "d", "value": 4.95, "unit": "um",
      "source": "data/particles.yaml bangs-dragongreen-5um-cooh, measured lot mean. Unchanged across r1, r3, r7 -- carried because the schema requires at least one primitive and this document introduces none.",
      "evidence": "measured", "origin": "am",
      "uncertainty": { "value": 0.15, "unit": "um", "kind": "systematic" } }
  ],

  "assumptions": [
    { "name": "per_rung_noise_model", "status": "unknown",
      "mine": "Still unmeasured on this side, which is why this document is assumptions_resolved: false. r8 put the route at 7.2-9.5 % against a 4.48 % tolerance, but that is a simulation of this measurement and not the measurement -- P7 is what measures it here, and P7 is the precondition this correction is about.",
      "theirs": "7.2-9.5 %, decomposed as 7.3-9.5 % from the equipartition alpha and 1.3-1.6 % from the drag slope.",
      "worth": { "value": 1.8, "unit": "dimensionless",
                 "note": "The ratio of route to tolerance, from r8. Copied rather than re-derived." },
      "note": "Carried so this correction does not read as though the thread's open question had closed. It has not." }
  ],

  "corrects": [
    { "ref": "am:bridge/threads/trap-stiffness-recovery/r7/ask_simulation.json",
      "round": 7,
      "what": "gaps[0].kind, on the gap 'The per-rung scatter on the drag-slope gamma, measured on real data'.",
      "why": "The field named a requirement the design does not have. `drag-prepare` and `drag-slope` read a path and know nothing about a microscope: numpy, pyyaml and pytest are the whole dependency list, so the fit runs wherever the file already is. Moving the bytes is therefore one of two interchangeable conveniences and not a precondition -- and the files are kilobytes, two columns and one row per frame, so neither option is even costly. The operator settled it the same way on 2026-09-16: producing a plan does not require being on site.",
      "was": "needs_data_transfer",
      "now": "needs_human_action",
      "downstream": [
        "am:bridge/threads/trap-stiffness-recovery/r7/ask_simulation.json#gaps[0].would_need -- 'The tracked positions ... moved off the instrument PC (D:\\codes) into reach' is now one of two options rather than the requirement. Reading it in place is equally admissible.",
        "bd:bridge/threads/trap-stiffness-recovery/r8/ask_experiment.json#gaps[1] -- carried the same kind forward from r7, so it inherits this correction. That document is BD's and is not edited here.",
        "am:kb/plans/2026-09-15-drag-calibration-stiffness-vs-size.md#P7 -- already corrected, at rev 4c52c4e: 'blocked on a person doing one of two interchangeable things', with the procedure expanded into four steps and the preparation step named."
      ] }
  ],

  "gaps": [
    { "what": "The per-rung scatter on the drag-slope gamma, on real data.",
      "why": "The tracked positions of the 2026-09-03 run have not been identified yet -- specifically the ones from BEFORE `creepx`, which detrends the mean displacement away by design, so its output cannot be used however it is post-processed.",
      "consequence": "The number that gets compared against r8's 4.48 % does not exist yet, so nothing in the thread has yet measured what this instrument delivers. r8's 7.2-9.5 % is a simulation of it.",
      "kind": "needs_human_action",
      "owner": "human",
      "would_need": "A person doing either of two interchangeable things: run `python -m calibration.cli drag-prepare <files> --frame-period-ms <achieved> --frame-period-source <where from>` then `drag-slope` where the files are, or copy them first and run the same two commands here. The design does not care which. What it does care about is the frame period: these files carry no time column, and the analysis PC hardcodes 0.02 s without reading metadata, so the period has to come from a timestamp column or a run report's achieved rate." },

    { "what": "A wall, and therefore h0 as a physical measurement.",
      "why": "Not a missing runner. At fixed h the wall's only effect is a scalar gamma, which enters no dimensionless group a trapped-bead case carries, so no runner can learn it. r8's gaps[0] states the same conclusion from that side.",
      "consequence": "h0 comes from this instrument or from nowhere, and r1's falsifier has fired against the ladder route on simulated evidence.",
      "kind": "not_buildable_here",
      "owner": "nobody",
      "would_need": "Nothing buildable. The alternative method -- testing the fit procedure on a synthetic gamma(h) -- is what r7 asked for and r8 delivered as sigma_gamma_max = 4.48 %." }
  ],

  "out_of_scope": [
    "Any new question. r8 answered r7, and the next ask travels as its own round rather than riding on a correction -- r4 set that precedent from the other side and gave the reason: a correction that also negotiates can be read as negotiating.",
    "r8's gaps[2], whether the ladder's six heights are the right six. Worth asking and not asked here.",
    "Any gate threshold. 4.48 % is `simulated` and lands with may_be_gate_threshold: false; it is a design target, and nothing in trapping/ has been changed to know about it."
  ],

  "derived_from": [
    { "ref": "bd:bridge/threads/trap-stiffness-recovery/r8/ask_experiment.json",
      "hash": "sha256:3c85ed0bd802d8b2",
      "note": "The round that answered r7. Read before this one: its first line reads as good news and the round is the opposite." },
    { "ref": "am:bridge/threads/trap-stiffness-recovery/r7/ask_simulation.json",
      "hash": "sha256:e45e8b5f6cdc9562",
      "rev": "5ec3531",
      "note": "The document corrected here. Unedited: a sealed document is not edited, metadata included -- that is what the suffixed-key cascade taught. ⚠ rev corrected 2026-09-16: this cited f2e5f94, which is 'r3: pin its refs to a revision' -- r7 did not exist at that commit. The rev was copied off r5's citation of r3 and landed on the r7 ref; the hash was right, and r7's blob at 5ec3531 hashes to the e45e8b5f6cdc9562 above. Third instance of this family in two days, and the second of mine: a rev is itself a citation and it rots the same way." }
  ],
  "confirmed_by": null
}
